{"accepted_evidence":{"adjudicated_units":241,"candidates":{"credible_missing_positive_by_track":{"economics":53,"psychology":44},"relevance":{"not_relevant":2544,"relevant":260},"relevance_by_track":{"economics":{"not_relevant":1198,"relevant":147},"psychology":{"not_relevant":1346,"relevant":113}},"suspected_missing_positive":{"credible":97,"not_applicable":291,"not_credible":2416},"suspected_missing_positive_by_track":{"economics":{"credible":53,"not_applicable":167,"not_credible":1125},"psychology":{"credible":44,"not_applicable":124,"not_credible":1291}}},"gold":{"ambiguity":{"ambiguous":10,"unambiguous":1225},"ambiguity_by_track":{"economics":{"ambiguous":1,"unambiguous":664},"psychology":{"ambiguous":9,"unambiguous":561}},"support":{"does_not_support":744,"partially_supports":290,"supports":201},"support_by_track":{"economics":{"does_not_support":390,"partially_supports":144,"supports":131},"psychology":{"does_not_support":354,"partially_supports":146,"supports":70}}},"queries":{"credible_missing_positive":{"no":78,"yes":42},"credible_missing_positive_queries_by_track":{"economics":21,"psychology":21},"decision_status":{"decided":119,"uncertain":1},"qrels_completeness":{"complete_enough":41,"incomplete":78,"uncertain":1}},"unresolved_queries":{"by_track":{"economics":1,"psychology":0},"total":1}},"candidate_id":"bright-qrels-remediation-candidate-v0.1","control_revision":{"changed_at":"2026-09-06T20:30:00Z","current_control_sha256":"ca007c6810649385ba384e4b7830871a45f932ed402b13fae257db192affbee1","current_proposal_schema_sha256":"cdf27a0e6d7dabe93730925d295dd69ff2381b1074076ac2a35546c1f752666b","previous_control_sha256":"d05de5d23f5cdff6a5dd12a38f6e856fecb634239641ef0f689e39b62e3dd9c2","previous_proposal_schema_sha256":"de3f42104e4325b86ff628ae5928a36114d0271f6ce19bce7aae20e5d9e8b389","reason":"Repair round 2 adds explicit supporting-span offsets without changing business rules.","rules_sha256":"4dacff181fff81caa87aa7ee40c7c165fe05e227436d53f97410bb6837bbb52c"},"control_sha256":"ca007c6810649385ba384e4b7830871a45f932ed402b13fae257db192affbee1","coverage":{"candidate_items":2804,"gold_items":1235,"queries":120,"tracks":{"economics":60,"psychology":60}},"diff":{"added_positive_rows":0,"negative_rows":0,"original_positive_rows_in_reviewed_scope":1235,"proposed_positive_rows":0,"quarantined_or_uncertain_positive_rows":1235,"retained_positive_rows":0},"dispositions":{"by_disposition":{"downgrade_to_uncertain":10,"no_change_unjudged":2513,"not_applicable":291,"quarantine_official_positive":1225,"stop_query_task_semantics_mismatch":120},"by_evidence_level":{"conflicting":130,"contextual_or_topical_only":2826,"document_level_support":459,"insufficient":744},"by_taxonomy":{"candidate_pool_coverage_gap":36,"credible_missing_positive":139,"gold_ambiguity":10,"gold_support_defect":1034,"insufficient_existing_evidence":1,"no_qrels_defect":2906,"task_semantics_mismatch":120},"by_unit_type":{"candidate":2804,"gold":1235,"query":120},"total":4159},"protected_surfaces_sha256":"8d4b79c1b5ab17f7e0922009fa3ecd0139f311ac5a40b7d785d47950ad85154c","publication":{"accepted_evidence_modified":false,"classification":"restricted_no_publish","default_activation":false,"leaderboard_allowed":false,"official_qrels_modified":false,"public_export_allowed":false,"publish_allowed":false,"registry_integration":false,"runner_integration":false,"status":"inactive"},"repair_round":2,"restricted_artifacts":{"files":{"evidence-ledger.jsonl":{"bytes":14477258,"rows":4159,"sha256":"e355cdeb3e46ba2cbdd4be060f2a69ede1b9a8932f11635324e153b38858dbf6"},"original-vs-proposed.jsonl":{"bytes":382740,"rows":1235,"sha256":"d883ae92b6548e46422c71d8036fcd6033f14d26b8510522fcc7b180f3cf410a"},"proposal.json":{"bytes":4342256,"rows":1,"sha256":"d4afe0a4848df0a745d9f06fa01e8679fbb8443dee35158db90bc013b6daf8a1"},"query-risk.jsonl":{"bytes":62082,"rows":120,"sha256":"59cdb911090825c013cc531bb125042695061f97cb46e5cca9518847b990f6d2"}},"manifest_sha256":"587947d7e2d4cbac5184742eae3e1e37344a9661bada3e7a697320de56b059d9","proposal_sha256":"d4afe0a4848df0a745d9f06fa01e8679fbb8443dee35158db90bc013b6daf8a1","tracked":false},"rules_sha256":"4dacff181fff81caa87aa7ee40c7c165fe05e227436d53f97410bb6837bbb52c","s007_candidate_input":{"eligible":false,"reason":"The derived overall verdict is not insufficient_existing_evidence.","story_modified_or_promoted":false},"safe_content":{"contains_absolute_private_paths":false,"contains_canonical_ids":false,"contains_proposed_qrels_rows":false,"contains_query_or_document_text":false,"contains_rankings":false,"contains_reversible_mapping":false,"contains_reviewer_identity":false,"contains_supporting_spans":false},"schema_version":"1","score_independence":{"method_outcomes_consumed":false,"model_scores_consumed":false,"rank_positions_consumed":false,"rankings_used_for_candidate_location":false},"sensitivity_boundaries":[{"condition":"current_frozen_local_contracts","reason":"linked-source relevance and direct answer support are not locally mapped","verdict":"task_semantics_mismatch"},{"condition":"linked_source_relevance_is_explicitly_adopted","reason":"the accepted support audit cannot validate or negate linked-source relevance","verdict":"insufficient_existing_evidence"},{"condition":"direct_answer_support_is_explicitly_adopted","reason":"membership changes still require independent item review and direct-span evidence","verdict":"insufficient_existing_evidence"}],"story_id":"S-20260906-001","tracks":{"economics":{"coverage":{"candidate_items":1345,"gold_items":665,"queries":60},"dispositions":{"downgrade_to_uncertain":1,"no_change_unjudged":1178,"not_applicable":167,"quarantine_official_positive":664,"stop_query_task_semantics_mismatch":60},"existing_evidence_gap":"No frozen local contract determines whether linked-source relevance or direct answer support governs qrels membership.","next_minimum_action":"Freeze one task-semantic definition, then independently review the same 60 frozen queries under that definition before any qrels activation.","retainable_scope":"none_of_the_reviewed_queries_until_task_semantics_are_resolved","reviewed_queries_eligible":0,"reviewed_queries_stopped":60,"taxonomy":{"candidate_pool_coverage_gap":21,"credible_missing_positive":74,"gold_ambiguity":1,"gold_support_defect":534,"insufficient_existing_evidence":1,"no_qrels_defect":1423,"task_semantics_mismatch":60},"unsupported_claims":["corrected_relevance_gold","full_track_repair","model_quality_recomparison","public_leaderboard"],"verdict":"task_semantics_mismatch"},"psychology":{"coverage":{"candidate_items":1459,"gold_items":570,"queries":60},"dispositions":{"downgrade_to_uncertain":9,"no_change_unjudged":1335,"not_applicable":124,"quarantine_official_positive":561,"stop_query_task_semantics_mismatch":60},"existing_evidence_gap":"No frozen local contract determines whether linked-source relevance or direct answer support governs qrels membership.","next_minimum_action":"Freeze one task-semantic definition, then independently review the same 60 frozen queries under that definition before any qrels activation.","retainable_scope":"none_of_the_reviewed_queries_until_task_semantics_are_resolved","reviewed_queries_eligible":0,"reviewed_queries_stopped":60,"taxonomy":{"candidate_pool_coverage_gap":15,"credible_missing_positive":65,"gold_ambiguity":9,"gold_support_defect":500,"no_qrels_defect":1483,"task_semantics_mismatch":60},"unsupported_claims":["corrected_relevance_gold","full_track_repair","model_quality_recomparison","public_leaderboard"],"verdict":"task_semantics_mismatch"}},"verdict":{"economics":"task_semantics_mismatch","overall":"task_semantics_mismatch","psychology":"task_semantics_mismatch"}}
